<?xml version="1.0" encoding="UTF-8"?>
<!DOCTYPE bahnhof SYSTEM "./bahnhof.dtd">

<?xml-stylesheet type="text/xsl" href="./bahnhof.xsl" ?>
<bahnhof>
  <name>Kranichsfeld</name>
  <kuerzel>KFD</kuerzel>
  <typ>Bf</typ>
  <verwaltung>DR</verwaltung>
  <maszstab>120</maszstab>
  <modulnr>JuUhl235</modulnr>
  <plan src="kfd.jpg" />
  <gleise>
    <zulaufstrecken>
      <links nr="1">1gl</links>
      <rechts nr="1">1gl</rechts>
    </zulaufstrecken>
    <hgleise>
      <gleis id="Gleis_1b">
        <name>1b</name>
        <laenge einheit="mm">1800</laenge>
        <bemerkung>Ein- und Ausfahrgleis</bemerkung>
      </gleis>
      <gleis id="Gleis_3b">
        <name>3b</name>
        <laenge einheit="mm">1550</laenge>
        <bemerkung>Ein- und Ausfahrgleis für Güterzüge</bemerkung>
      </gleis>
      <gleis id="Gleis_5">
        <name>5</name>
        <laenge einheit="mm">1600</laenge>
        <bemerkung>Ein- und Ausfahrgleis für Güterzüge</bemerkung>
      </gleis>
      <gleis id="Gleis_1a">
        <name>1a</name>
        <laenge einheit="mm">840.0</laenge>
        <bemerkung>Hausbahnsteig</bemerkung>
      </gleis>
    </hgleise>
    <ngleise>
      <gleis id="Gleis_2a">
        <name>2a</name>
        <laenge einheit="mm">500</laenge>
        <bemerkung>Einsatzstelle mit Triebwagenschuppen</bemerkung>
      </gleis>
      <gleis id="Gleis_2b">
        <name>2b</name>
        <laenge einheit="mm">1300</laenge>
        <bemerkung>Umfahrgleis</bemerkung>
      </gleis>
      <gleis id="Gleis_3a">
        <name>3a</name>
        <laenge einheit="mm">150</laenge>
        <bemerkung>Seitenrampe</bemerkung>
      </gleis>
      <gleis id="Gleis_3c">
        <name>3c</name>
        <laenge einheit="mm">650</laenge>
        <bemerkung>Güterschuppen</bemerkung>
      </gleis>
      <gleis id="Gleis_4">
        <name>4</name>
        <laenge einheit="mm">1700</laenge>
        <bemerkung>Ladestraße/Freiladegleis und Kopframpe</bemerkung>
      </gleis>
      <gleis id="Gleis_A1">
        <name>A1</name>
        <laenge einheit="mm">350.0</laenge>
        <bemerkung>Sammelgleis Salzsäure</bemerkung>
      </gleis>
      <gleis id="gleisA2">
        <name>A2</name>
        <laenge einheit="mm">370.0</laenge>
        <bemerkung>Abfüll- und Entladestelle Salzsäure</bemerkung>
      </gleis>
    </ngleise>
  </gleise>
  <pv>
    <bahnsteig gleis="Gleis_1a">
      <name>Hausbahnsteig</name>
      <laenge einheit="mm">800</laenge>
    </bahnsteig>
    <bemerkung>Taktverkehr in der Regel mit Triebwagen prägen das Vorbild in der Zeit ab 1995. In der Folge wird der Bahnhof zum Haltepunkt umgebaut.[br]Bei eingeschränktem Güterverkehr kann das Güterschuppengleis als Bahnsteiggleis für kurze Züge oder Triebwagen genutzt werden. Beachte dann aber die Ausfahrrichtung.</bemerkung>
  </pv>
  <gv>
    <ladestelle id="Kopframpe" gleis="Gleis_4">
      <name>Kopframpe</name>
      <laenge einheit="mm">200</laenge>
    </ladestelle>
    <ladestelle id="Seitenrampe" gleis="Gleis_3a">
      <name>Seitenrampe</name>
      <laenge einheit="mm">150</laenge>
    </ladestelle>
    <ladestelle id="Ladestraße" gleis="Gleis_4">
      <name>Ladestraße</name>
      <laenge einheit="mm">1500</laenge>
    </ladestelle>
    <ladestelle id="Güterschuppen" gleis="Gleis_3c">
      <name>Güterschuppen</name>
      <laenge einheit="mm">450.0</laenge>
    </ladestelle>
    <ladestelle id="Einsatzstelle" gleis="Gleis_2a">
      <name>Einsatzstelle</name>
      <laenge einheit="mm">500</laenge>
    </ladestelle>
    <ladestelle id="Valentin_Fl_ssiggas" gleis="Gleis_A1">
      <name>Valentin Flüssiggas</name>
      <laenge einheit="mm">370.0</laenge>
    </ladestelle>
    <ladestelle id="Entladestelle_Valentin_Fl_ssiggas" gleis="gleisA2">
      <name>Entladestelle Valentin Flüssiggas</name>
      <laenge einheit="mm">350.0</laenge>
    </ladestelle>
    <verlader>
      <name>Kabel-AG, Werk Kranichsfeld</name>
      <empfang>
        <ladegut ladestelle="Ladestraße">
          <name>Plastgranulat</name>
          <gattung>H</gattung>
          <wagen zeitraum="woche">2</wagen>
        </ladegut>
        <ladegut ladestelle="Ladestraße">
          <name>Leitungskupfer</name>
          <gattung>H</gattung>
          <wagen zeitraum="woche">1</wagen>
        </ladegut>
      </empfang>
      <versand>
        <ladegut ladestelle="Ladestraße">
          <name>Installationskabel</name>
          <gattung>H</gattung>
          <wagen zeitraum="woche">2.0</wagen>
        </ladegut>
      </versand>
    </verlader>
    <verlader>
      <name>Forstwirtschaftsbetrieb Kranichsfeld</name>
      <empfang>
        <ladegut ladestelle="Ladestraße">
          <name>Pestizide</name>
          <gattung>Z/G/H</gattung>
          <wagen zeitraum="woche">1</wagen>
        </ladegut>
      </empfang>
      <versand>
        <ladegut ladestelle="Ladestraße">
          <name>Stammholz</name>
          <gattung>E/R/S</gattung>
          <wagen zeitraum="woche">3</wagen>
        </ladegut>
        <ladegut ladestelle="Ladestraße">
          <name>Rindenmulch</name>
          <gattung>E</gattung>
          <wagen zeitraum="woche">1</wagen>
        </ladegut>
      </versand>
    </verlader>
    <verlader>
      <name>Schraubenwerk Kranichsfeld</name>
      <empfang>
        <ladegut ladestelle="Ladestraße">
          <name>Rundstahl</name>
          <gattung>X/E/R</gattung>
          <wagen zeitraum="woche">1</wagen>
        </ladegut>
      </empfang>
      <versand>
        <ladegut ladestelle="Ladestraße">
          <name>Schrauben, Muttern</name>
          <gattung>G/H</gattung>
          <wagen zeitraum="woche">2</wagen>
        </ladegut>
        <ladegut ladestelle="Kopframpe">
          <name>Holzschrauben</name>
          <gattung>Container</gattung>
          <wagen zeitraum="woche">1</wagen>
        </ladegut>
      </versand>
    </verlader>
    <verlader>
      <name>Agrargenossenschaft Kranichsfeld</name>
      <empfang>
        <ladegut ladestelle="Ladestraße">
          <name>Saatgut</name>
          <gattung>G/H/T</gattung>
          <wagen zeitraum="woche">1</wagen>
        </ladegut>
      </empfang>
      <versand>
        <ladegut ladestelle="Ladestraße">
          <name>Getreide</name>
          <gattung>G/H/T</gattung>
          <wagen zeitraum="woche">4</wagen>
        </ladegut>
        <ladegut ladestelle="Ladestraße">
          <name>Braugerste</name>
          <gattung>G/H/Container</gattung>
          <wagen zeitraum="woche">1</wagen>
        </ladegut>
      </versand>
    </verlader>
    <verlader>
      <name>Valentin Flüssiggas</name>
      <empfang>
        <ladegut ladestelle="Entladestelle_Valentin_Fl_ssiggas">
          <name>Flüssiggas</name>
          <gattung>Z</gattung>
          <wagen>3</wagen>
        </ladegut>
      </empfang>
    </verlader>
    <bemerkung>Landwirtschaft, Kabelwerk, Schraubenwerk, Forstwirtschaft, Flüssiggashändler</bemerkung>
  </gv>
  <bemerkung>Der Endbahnhof der Ilmtalbahn Kranichfeld diente als erstes Vorbild für den Modulbahnhof. Inzwischen hat der Bahnhof etliche Erweiterungen erfahren und kann auch als Durchgangsbahnhof betrieben werden.</bemerkung>
</bahnhof>
