<?xml version="1.0" encoding="utf-8"?>
<!DOCTYPE bahnhof SYSTEM "./bahnhof.dtd" >
<?xml-stylesheet type="text/xsl" href="./bahnhof.xsl" ?>
<bahnhof>
	<name>Holzwerk</name>
	<kuerzel>AHW</kuerzel>
	<typ>Anschl</typ>
	<maszstab>120</maszstab>
	<modulnr>MiSch393</modulnr>
	<plan src="ahw.svg"/>
	<gleise>
		<zulaufstrecken>
			<links nr="1">1gl</links>
			<rechts nr="1">1gl</rechts>
		</zulaufstrecken>
		<hgleise>
			<gleis id="Bahnsteiggleis">
				<name>Streckengleis</name>
				<laenge>2000</laenge>
			</gleis>
		</hgleise>
		<ngleise>
			<gleis id="gleis_1">
				<name>1</name>
				<laenge>1330</laenge>
			</gleis>
			<gleis id="gleis_2">
				<name>2</name>
				<laenge>1330</laenge>
			</gleis>
		</ngleise>
	</gleise>
	<gv>
		<ladestelle id="Kranverladung" gleis="gleis_1 gleis_2">
			<name>Kranverladung</name>
			<laenge> </laenge>
		</ladestelle>
		<verlader>
			<name>Holzwerk</name>
			<versand>
				<ladegut ladestelle="Kranverladung">
					<name>Stammholz</name>
					<gattung>K, R, Eas</gattung>
					<wagen zeitraum="tag">10</wagen>
				</ladegut>
				<ladegut ladestelle="Kranverladung">
					<name>Bretter</name>
					<gattung>K, R, Eas</gattung>
					<wagen zeitraum="tag">10</wagen>
				</ladegut>
			</versand>
		</verlader>
	</gv>
</bahnhof>
