<?xml version="1.0" encoding="utf-8"?>
<!DOCTYPE bahnhof SYSTEM "./bahnhof.dtd" >
<?xml-stylesheet type="text/xsl" href="./bahnhof.xsl" ?>
<bahnhof>
	<name>Biegen</name>
	<kuerzel>BIE</kuerzel>
	<typ>Sbf</typ>
	<verwaltung>DB</verwaltung>
	<maszstab>120</maszstab>
	<modulnr>DiThe100</modulnr>
	<plan src="bie.jpg"/>
	<gleise>
		<zulaufstrecken>
			<links nr="1">1gl</links>
		</zulaufstrecken>
		<hgleise>
			<gleis id="gl1">
				<name>1</name>
				<laenge>1700</laenge>
			</gleis>
			<gleis id="gl2">
				<name>2</name>
				<laenge>1700</laenge>
			</gleis>
			<gleis id="gl3">
				<name>3</name>
				<laenge>1700</laenge>
			</gleis>
			<gleis id="gl4">
				<name>4</name>
				<laenge>1700</laenge>
			</gleis>
			<gleis id="gl5">
				<name>5</name>
				<laenge>1700</laenge>
			</gleis>
			<gleis id="gl6">
				<name>6</name>
				<laenge>1700</laenge>
			</gleis>
			<gleis id="gl7">
				<name>7</name>
				<laenge>1700</laenge>
			</gleis>
			<gleis id="gl8">
				<name>8</name>
				<laenge>1700</laenge>
			</gleis>
			<gleis id="gl9">
				<name>9</name>
				<laenge>1700</laenge>
			</gleis>
			<gleis id="gl10">
				<name>10</name>
				<laenge>1700</laenge>
			</gleis>
			<gleis id="gl11">
				<name>11</name>
				<laenge>1700</laenge>
			</gleis>
			<gleis id="gl12">
				<name>12</name>
				<laenge>1700</laenge>
			</gleis>
		</hgleise>
		<ngleise>
			<gleis id="l1">
				<name>l1</name>
				<laenge>150</laenge>
				<bemerkung>Lok Abstell</bemerkung>
			</gleis>
			<gleis id="l2">
				<name>l2</name>
				<laenge>150</laenge>
				<bemerkung>Lok Abstell</bemerkung>
			</gleis>
		</ngleise>
	</gleise>
	<bemerkung>Schwenkweiche</bemerkung>
</bahnhof>
