<?xml version="1.0" encoding="UTF-8"?>
<?xml-stylesheet type="text/xsl" href="./bahnhof.xsl"?>
<!DOCTYPE bahnhof SYSTEM "./bahnhof.dtd">

<bahnhof>
  <name>Altenstein</name>
  <kuerzel>ALT</kuerzel>
  <typ>Bf</typ>
  <verwaltung>DB</verwaltung>
  <maszstab>120.0</maszstab>
  <modulnr>GeReh203</modulnr>
  <plan src="alt.jpg" />
  <gleise>
    <zulaufstrecken />
    <hgleise>
      <gleis id="gleis_1">
        <name>1</name>
        <laenge>1160.0</laenge>
        <bemerkung>Durchgangsgleis (durchgehender Güter-/Personenverkehr aus Richtung Westen)</bemerkung>
      </gleis>
      <gleis id="gleis_2">
        <name>2</name>
        <laenge>1100.0</laenge>
        <bemerkung>Kreuzungsgleis (durchgehender Güter-/Personenverkehr aus Richtung Osten)</bemerkung>
      </gleis>
      <gleis id="gleis_3-33">
        <name>3-33</name>
        <laenge>630.0</laenge>
        <bemerkung>endender Personenverkehr aus Richtung Westen</bemerkung>
      </gleis>
    </hgleise>
    <ngleise>
      <gleis id="gleis_12">
        <name>12</name>
        <laenge>260.0</laenge>
        <bemerkung>Abstellgleis</bemerkung>
      </gleis>
      <gleis id="gleis_22">
        <name>22</name>
        <laenge>410.0</laenge>
        <bemerkung>Abstellgleis</bemerkung>
      </gleis>
      <gleis id="gleis_13">
        <name>13</name>
        <laenge>360.0</laenge>
        <bemerkung>Ladestraße I</bemerkung>
      </gleis>
      <gleis id="gleis_4">
        <name>4</name>
        <laenge>160.0</laenge>
        <bemerkung>Bereitstellung Güterwagen</bemerkung>
      </gleis>
      <gleis id="gleis_24">
        <name>24</name>
        <laenge>160.0</laenge>
        <bemerkung>Lokeinsatzstelle (Lokschuppen)</bemerkung>
      </gleis>
      <gleis id="gleis_5">
        <name>5</name>
        <laenge>240.0</laenge>
        <bemerkung>Ladestraße II / Lademaß, Waage</bemerkung>
      </gleis>
      <gleis id="gleis_15">
        <name>15</name>
        <laenge>160.0</laenge>
        <bemerkung>Kopf- und Seitenrampe, Viehverladung</bemerkung>
      </gleis>
      <gleis id="gleis_6">
        <name>6</name>
        <laenge>600.0</laenge>
        <bemerkung>Lokverkehrsgleis</bemerkung>
      </gleis>
      <gleis id="gleis_16">
        <name>16</name>
        <laenge>180.0</laenge>
        <bemerkung>Anschlussgleis Fa. Lampen Apparatebau</bemerkung>
      </gleis>
      <gleis id="gleis_25">
        <name>25</name>
        <laenge>180.0</laenge>
        <bemerkung>Güterschuppen</bemerkung>
      </gleis>
    </ngleise>
  </gleise>
  <pv>
    <bahnsteig gleis="gleis_3-33">
      <name>A - Hausbahnsteig</name>
      <laenge>630.0</laenge>
    </bahnsteig>
    <bahnsteig gleis="gleis_1">
      <name>B - Zwischenbahnsteig</name>
      <laenge>1160.0</laenge>
    </bahnsteig>
    <bahnsteig gleis="gleis_2">
      <name>C - Zwischenbahnsteig</name>
      <laenge>1100.0</laenge>
    </bahnsteig>
    <bemerkung>Berufs- und Schülerverkehr</bemerkung>
  </pv>
  <gv>
    <ladestelle id="Ladestra_e_I" gleis="gleis_13">
      <name>Ladestraße I</name>
      <laenge>360.0</laenge>
    </ladestelle>
    <ladestelle id="Ladestra_e_II_Waage_Ladema_" gleis="gleis_5">
      <name>Ladestraße II, Waage, / Lademaß</name>
      <laenge>170.0</laenge>
    </ladestelle>
    <ladestelle id="Laderampe" gleis="gleis_15">
      <name>Laderampe</name>
      <laenge>80.0</laenge>
    </ladestelle>
    <ladestelle id="Viehverladung" gleis="gleis_15">
      <name>Viehverladung</name>
      <laenge>80.0</laenge>
    </ladestelle>
    <ladestelle id="G_terschuppen_St_ckgut_" gleis="gleis_25">
      <name>Güterschuppen (Stückgut)</name>
      <laenge>180.0</laenge>
    </ladestelle>
    <ladestelle id="Fa._Lampen_Apparatebau" gleis="gleis_16">
      <name>Fa. Lampen Apparatebau</name>
      <laenge>180.0</laenge>
    </ladestelle>
    <ladestelle id="Kohlebansen" gleis="gleis_24">
      <name>Kohlebansen</name>
      <laenge>160.0</laenge>
    </ladestelle>
    <verlader>
      <name>Peter Lampen GmbH &amp; Co. KG, Feinmechanische Werkstatt</name>
      <empfang>
        <ladegut ladestelle="Fa._Lampen_Apparatebau">
          <name>Kunststoffhalbzeuge, Metallhalbzeuge</name>
          <gattung>G, H</gattung>
          <wagen>1.0</wagen>
        </ladegut>
        <ladegut ladestelle="Fa._Lampen_Apparatebau">
          <name>Holzbretter, Holzleisten für Transportverpackungen</name>
          <gattung>E, G, H, R, S</gattung>
          <wagen>1.0</wagen>
        </ladegut>
        <ladegut ladestelle="Fa._Lampen_Apparatebau">
          <name>Baulelemente</name>
          <gattung>G, H</gattung>
          <wagen>1.0</wagen>
        </ladegut>
      </empfang>
      <versand>
        <ladegut ladestelle="Laderampe">
          <name>Apparate</name>
          <gattung>G, H, R, S</gattung>
          <wagen>1.0</wagen>
        </ladegut>
      </versand>
    </verlader>
    <verlader>
      <name>Heinrich Stiebe, Brennstoffhandel</name>
      <empfang>
        <ladegut ladestelle="Ladestra_e_I">
          <name>Eierkohlen, Briketts</name>
          <gattung>E</gattung>
          <wagen>5.0</wagen>
        </ladegut>
        <ladegut ladestelle="Ladestra_e_I">
          <name>Heizöl in Fässern</name>
          <gattung>E</gattung>
          <wagen>3.0</wagen>
        </ladegut>
      </empfang>
    </verlader>
    <verlader>
      <name>Senffabrik Finkenburg OHG</name>
      <empfang>
        <ladegut ladestelle="Laderampe">
          <name>Senfkörner Zucker (gesackt)</name>
          <gattung>G, H</gattung>
          <wagen>5.0</wagen>
        </ladegut>
        <ladegut ladestelle="Ladestra_e_II_Waage_Ladema_">
          <name>Wein in Fässern</name>
          <gattung>G, H</gattung>
          <wagen>3.0</wagen>
        </ladegut>
        <ladegut ladestelle="Laderampe">
          <name>Etikettiermaschinen, Verpackungsmaschinen</name>
          <gattung>R, S</gattung>
          <wagen>1.0</wagen>
        </ladegut>
      </empfang>
      <versand>
        <ladegut ladestelle="Laderampe">
          <name>Senferzeugnisse</name>
          <gattung>G, H</gattung>
          <wagen zeitraum="tag">1.0</wagen>
        </ladegut>
      </versand>
    </verlader>
    <verlader>
      <name>Bauerngenossenschaft Altensteiner Land e.G.</name>
      <empfang>
        <ladegut ladestelle="Ladestra_e_I">
          <name>Düngemittel, lose</name>
          <gattung>T</gattung>
          <wagen>2.0</wagen>
        </ladegut>
        <ladegut ladestelle="G_terschuppen_St_ckgut_" typ="stueckgut">
          <name>Saatgut, gesackt als Stückgut</name>
          <gattung>G, H</gattung>
          <wagen>3.0</wagen>
        </ladegut>
        <ladegut ladestelle="G_terschuppen_St_ckgut_" typ="stueckgut">
          <name>Futtermittel, gesackt als Stückgut</name>
          <gattung>G, H</gattung>
          <wagen>3.0</wagen>
        </ladegut>
        <ladegut ladestelle="Viehverladung">
          <name>Jungvieh</name>
          <gattung>V</gattung>
          <wagen>2.0</wagen>
        </ladegut>
        <ladegut ladestelle="Laderampe">
          <name>Landmaschinen</name>
          <gattung>E, R, S</gattung>
          <wagen>1.0</wagen>
        </ladegut>
      </empfang>
      <versand>
        <ladegut ladestelle="Ladestra_e_I">
          <name>Äpfel</name>
          <gattung>E</gattung>
          <wagen>1.0</wagen>
        </ladegut>
        <ladegut ladestelle="Ladestra_e_I">
          <name>Zuckerrüben</name>
          <gattung>E</gattung>
          <wagen>1.0</wagen>
        </ladegut>
        <ladegut ladestelle="Viehverladung">
          <name>Schlachtrinder, Schlachtschweine</name>
          <gattung>G, V</gattung>
          <wagen>3.0</wagen>
        </ladegut>
        <ladegut ladestelle="Ladestra_e_II_Waage_Ladema_" typ="expressgut">
          <name>Frischgemüse, Schnittblumen als Eilgut</name>
          <gattung>G, H</gattung>
          <wagen zeitraum="tag">1.0</wagen>
        </ladegut>
      </versand>
    </verlader>
    <verlader>
      <name>Lokeinsatzstelle</name>
      <empfang>
        <ladegut ladestelle="Kohlebansen">
          <name>Lokkohle</name>
          <gattung>E</gattung>
          <wagen zeitraum="tag">1.0</wagen>
        </ladegut>
        <ladegut ladestelle="Kohlebansen">
          <name>Ersatzteile</name>
          <gattung>G, K, X</gattung>
          <wagen>1.0</wagen>
        </ladegut>
      </empfang>
      <versand>
        <ladegut ladestelle="Kohlebansen">
          <name>Altöl in Fässern</name>
          <gattung>G</gattung>
          <wagen>1.0</wagen>
        </ladegut>
        <ladegut ladestelle="Kohlebansen">
          <name>Tauschteile</name>
          <gattung>E, K, X</gattung>
          <wagen>1.0</wagen>
        </ladegut>
        <ladegut ladestelle="Laderampe">
          <name>Schlacke</name>
          <gattung>E</gattung>
          <wagen zeitraum="tag">1.0</wagen>
        </ladegut>
      </versand>
    </verlader>
  </gv>
</bahnhof>

